{
  "acceptance_checks": {
    "exact_sign_test_p_value_within_threshold": true,
    "identity_review_gate_preserved": true,
    "matrix_mismatch_caveat_preserved": true,
    "mean_paired_log2_change_above_threshold": true,
    "minimum_complete_positive_pairs_met": true,
    "responder_proportion_above_threshold": true,
    "timing_review_gate_preserved": true
  },
  "acceptance_rules": {
    "cached_log2fc_absolute_tolerance": 1e-12,
    "cached_mean_absolute_tolerance": 1e-12,
    "exact_sign_test_alternative": "two_sided",
    "maximum_exact_sign_test_p_value": 0.05,
    "mean_paired_log2_change_operator": "greater_than",
    "mean_paired_log2_change_threshold": 0.0,
    "minimum_complete_positive_pairs": 30,
    "minimum_responder_proportion": 0.5,
    "responder_proportion_operator": "greater_than"
  },
  "analysis_metadata": {
    "analysis_id": "AN006016",
    "analysis_summary": "Reversed phase UNSPECIFIED ION MODE",
    "analysis_type": "MS",
    "chromatography_type": "Reversed phase",
    "ms_instrument_name": "Thermo Q Exactive HF hybrid Orbitrap",
    "ms_instrument_type": "Orbitrap",
    "study_id": "ST003662",
    "units": "umol/L whole blood"
  },
  "cached_effect_crosscheck": {
    "absolute_difference": 2.220446049250313e-16,
    "absolute_tolerance": 1e-12,
    "cached_fdr": 2.5047225355558747e-14,
    "cached_fdr_status": "not_independently_recomputed",
    "cached_log2fc": 1.158602604139859,
    "cached_mean_post": 0.7552617628879312,
    "cached_mean_pre": 0.5391989305689655,
    "cached_neg_log10_p": 14.563451815873849,
    "cached_p_value": 2.7324245842427723e-15,
    "cached_p_value_status": "not_independently_recomputed",
    "mean_absolute_tolerance": 1e-12,
    "mean_post_absolute_difference": 2.220446049250313e-16,
    "mean_pre_absolute_difference": 0.0,
    "means_within_tolerance": true,
    "neg_log10_p_absolute_difference": 0.0,
    "neg_log10_p_internal_consistency": true,
    "recomputed_mean_paired_log2_change": 1.1586026041398587,
    "recomputed_mean_post": 0.755261762887931,
    "recomputed_mean_pre": 0.5391989305689655,
    "stratum": "all",
    "study_id": "ST003662",
    "within_tolerance": true
  },
  "case_id": "lacphe_li_2022_st003662_directional",
  "cohort_independence_status": "not_established",
  "dataset_selection_status": "post_hoc_exploratory",
  "exact_paper_dataset": false,
  "interpretation": "This is a post-hoc repository After-versus-Before directional check in ST003662, not an established corroboration or exact reproduction of the Li et al. datasets or causal feeding/obesity findings. The cached source calls the contrast post-versus-pre exercise, but no raw factor/codebook snapshot is bound, so that exercise-timing interpretation is not independently verified. Dataset selection was exploratory, cohort independence is not established, metabolite identity still requires human review, and whole-blood comparability remains unresolved.",
  "outcome": "supports_repository_after_vs_before_direction_requires_identity_and_timing_review",
  "paired_statistics": {
    "complete_positive_pairs": 116,
    "exact_sign_test": {
      "alternative": "two_sided",
      "exact_fraction": "1472724669120866632480669/10384593717069655257060992658440192",
      "n_non_tied": 116,
      "negative_count": 24,
      "p_value": 1.4181822700488305e-10,
      "p_value_status": "computed_finite",
      "positive_count": 92
    },
    "excluded_incomplete_or_nonpositive_pairs": 21,
    "geometric_mean_fold_change": 2.2324109131516057,
    "geometric_mean_fold_change_status": "computed_finite",
    "mean_paired_log2_change": 1.1586026041398587,
    "nonresponder_count": 24,
    "responder_count": 92,
    "responder_proportion": 0.7931034482758621,
    "tie_count": 0,
    "total_queried_rows": 137
  },
  "paper_claim": {
    "analyte_evidence_verified_in_cached_record": true,
    "data_availability_evidence": "no_accession_in_retrieved_text",
    "direction": "Lac-Phe is higher after exercise",
    "direction_evidence_field": "abstract",
    "direction_evidence_phrases_verified": true,
    "doi": "10.1038/s41586-022-04828-5",
    "doi_verified_in_cached_record": true,
    "evidence_tier": "peer_reviewed_primary",
    "original_paper_dataset_used": false,
    "pmcid": "PMC9767481",
    "pmid": "35705806",
    "record_url": "https://europepmc.org/article/MED/35705806",
    "review_status": "requires_human_review",
    "screen_basis": "tier=peer_reviewed_primary; species_basis=title_abstract_text; text_basis=text_with_abstract",
    "source_system": "europe_pmc",
    "source_url": "https://www.ebi.ac.uk/europepmc/webservices/rest/search?query=%28%22N-Lactoyl+phenylalanine%22+OR+%22Lac-Phe%22+OR+%22N-lactoylphenylalanine%22+OR+%22lactoylphenylalanine%22+OR+%22N-lactoyl-phenylalanine%22%29&format=json&resultType=core&pageSize=100&cursorMark=%2A",
    "title": "An exercise-inducible metabolite that suppresses feeding and obesity"
  },
  "replication_context": {
    "cohort_independence_status": "not_established",
    "contrast": "repository-derived Collectionpoint After vs Before; exercise-timing interpretation unverified",
    "dataset_selection_caveat": "ST003662 was selected post hoc after the Li et al. claim was known; cohort independence from the paper is not established, so this is a hypothesis-generating repository After-versus-Before directional check only.",
    "dataset_selection_status": "post_hoc_exploratory",
    "harmonization_eligibility": "requires_assay_identity_review",
    "identity_status": "requires_human_review",
    "matrix_mismatch_caveat": "ST003662 reports whole-blood abundance, whereas Li et al. describes circulating Lac-Phe using distinct cohorts and assays; matrix and quantitative comparability are not established.",
    "matrix_relationship_to_paper": "mismatch",
    "orientation": "positive log2fc = higher repository-derived After vs Before",
    "post_collectionpoint": "After",
    "pre_collectionpoint": "Before",
    "refmet_id": "RM0131640",
    "refmet_name": "N-Lactoyl phenylalanine",
    "refmet_release_status": "not_recorded_in_cached_annotation_file",
    "sample_matrix": "whole blood",
    "source_metabolite": "Lactoyl Phenylalanine",
    "species": "Homo sapiens",
    "stratum": "all",
    "study_id": "ST003662",
    "study_title": "Metabolome trajectory of exercise physiology- a comprehensive study of healthy male and female athletes",
    "timing_caveat": "The cached ST003662 sample table contains repository-derived Before/After labels, but the raw factor/codebook snapshot is not bound; the exercise relationship, modality, intensity, duration, and sampling delay are not independently verified.",
    "timing_status": "repository_derived_before_after_labels_raw_factor_context_not_bound",
    "unit": "umol/L whole blood (study-reported)"
  },
  "result_version": "1.1.0",
  "scope": "post_hoc_repository_after_vs_before_directional_check",
  "source_locator": {
    "analysis_id": "AN006016",
    "analysis_type": "LCMS",
    "chromatography": "Reversed phase",
    "harmonization_eligibility": "requires_assay_identity_review",
    "link_status": "metstat_row_links_analyte_study_and_analysis",
    "match_basis": "refmet_name_exact",
    "provenance_url": "https://www.metabolomicsworkbench.org/rest/metstat/;;;;;;;N-Lactoyl%20phenylalanine",
    "refmet_name": "N-Lactoyl phenylalanine",
    "review_status": "requires_human_review",
    "sample_source": "Blood",
    "source_system": "metabolomics_workbench_metstat",
    "study_id": "ST003662"
  },
  "source_provenance": {
    "license": "CC BY 4.0",
    "match_basis": "normalized name containment across source name columns",
    "source_asserted_contrast": "post-exercise vs pre-exercise (Collectionpoint After vs Before)",
    "source_asserted_orientation": "positive log2fc = higher post-exercise",
    "study_link": "https://www.metabolomicsworkbench.org/data/DRCCMetadata.php?StudyID=ST003662",
    "timing_interpretation_status": "repository_derived_before_after_labels_raw_factor_context_not_bound"
  }
}
